{
  "cluster_name": "dev-west",
  "environment": "dev",
  "deployment_mode": "standalone",
  "gitops_repo_url": "https://github.com/example/observability-kit-gitops.git",
  "gitops_path": "clusters/dev-west",
  "base_domain": "dev.example.internal",
  "storage_profile": "gp3",
  "object_storage_profile": "s3-compatible",
  "identity_profile": "oidc",
  "secret_profile": "external-secrets",
  "ingress_profile": "nginx"
}
